{
  "id": "hus-psykiatria-hoitoviiveet",
  "instanssi": "HUS Psykiatria",
  "toimiala": "terveydenhuolto",
  "periodi": "2010–2025",
  "kuvaus": "Hoitoviiveiden muodostamat toistuvat päätösketjut psykiatriassa ja niiden ennustettavat seuraukset. Casebook keskittyy järjestelmätason oppimiseen, ei yksittäisiin potilaisiin.",
  "lähteet": [
    "THL: Psykiatrisen hoidon saatavuusraportit",
    "Valtiontalouden tarkastusvirasto: Mielenterveyspalvelut",
    "HUS julkiset toimintakertomukset",
    "Kansainväliset meta-analyysit hoitoviiveistä ja itsetuhoisuudesta"
  ],
  "cases": [
    {
      "case_id": "depressio_itsetuho_viive",
      "metadata": {
        "vuosi": 2018,
        "ikä": 32,
        "huomautus": "Aggregoitu malli useista samankaltaisista hoitopoluista"
      },
      "paths": [
        {
          "trigger": "Masennus ja itsetuhoinen oireilu ensikontaktissa",
          "tulkinta": "Arvioidaan ei-akuutiksi, soveltuu avohoitoon",
          "toimenpide": "Ei välitöntä hoitoa, ohjaus jonoon",
          "seuraus": "Hoidon aloitus viivästyy, oireet pahenevat",
          "todennäköisyys": 0.7,
          "kesto_vuotta": 1.0,
          "hypoteesi": false
        },
        {
          "trigger": "Pitkittynyt hoitoviive",
          "tulkinta": "Tilanne nähdään muuttumattomana resurssipulan vuoksi",
          "toimenpide": "Tilapäiset kriisikontaktit ja kotiutus",
          "seuraus": "Toistuvat päivystyskäynnit ja uusi kriisi",
          "todennäköisyys": 0.4,
          "kesto_vuotta": 0.5,
          "hypoteesi": false
        },
        {
          "trigger": "Uusi vakava kriisi",
          "tulkinta": "Tilanne eskaloitunut",
          "toimenpide": "Akuutti hoito kriisin kautta",
          "seuraus": "Korkea kuormitus potilaalle ja järjestelmälle",
          "todennäköisyys": 0.15,
          "kesto_vuotta": 0.2,
          "hypoteesi": false
        }
      ],
      "learning": {
        "pdca": {
          "plan": "Riskipotilaan tunnistaminen ensikontaktissa",
          "do": "Hoidon siirtäminen jonoon resurssisyistä",
          "check": "Oireiden paheneminen ja toistuvat kriisit",
          "act": "Hoitoviiveen käsittely aktiivisena päätöksenä, ei neutraalina tilana"
        },
        "targets": [
          {
            "id": "T1",
            "taso": "Muistaminen",
            "toiminta": "tunnistaa",
            "mittaus": "Triggerien nimeäminen päätösketjussa",
            "kriteeri": "3/3 triggeriä tunnistettu",
            "status": "pending"
          },
          {
            "id": "T2",
            "taso": "Analysoiminen",
            "toiminta": "kuvaa",
            "mittaus": "Päätösketjun visualisointi",
            "kriteeri": "Kaikki vaiheet oikein järjestyksessä",
            "status": "pending"
          },
          {
            "id": "T3",
            "taso": "Luominen",
            "toiminta": "laatia",
            "mittaus": "Prosessimuutosehdotus",
            "kriteeri": "Vähintään yksi realistinen katkaisupiste",
            "status": "pending"
          }
        ]
      }
    }
  ]
}
