{
  "id": "hus-psykiatria-hoitoviiveet",
  "instanssi": "HUS Psykiatria",
  "toimiala": "terveydenhuolto",
  "periodi": "2010–2025",
  "kuvaus": "Hoitoviiveiden muodostamat toistuvat päätösketjut psykiatriassa ja niiden ennustettavat seuraukset. Tarkastelu on aggregoitu ja järjestelmätasoinen.",
  "lähteet": [
    "THL: Psykiatrisen hoidon saatavuusraportit",
    "VTV: Mielenterveyspalvelujen arvioinnit",
    "HUS julkiset toimintakertomukset",
    "Kansainväliset tutkimukset hoitoviiveistä ja itsetuhoisuudesta"
  ],
  "cases": [
    {
      "case_id": "depressio_itsetuho_viive",
      "metadata": {
        "vuosi": 2018,
        "ikä": 32,
        "huomautus": "Aggregoitu malli useista samankaltaisista hoitopoluista"
      },
      "paths": [
        {
          "trigger": "Masennus ja itsetuhoinen oireilu ensikontaktissa",
          "tulkinta": "Arvioidaan ei-akuutiksi",
          "toimenpide": "Ohjaus jonoon",
          "seuraus": "Hoidon aloitus viivästyy",
          "todennäköisyys": 0.7,
          "kesto_vuotta": 1.0,
          "hypoteesi": false
        },
        {
          "trigger": "Pitkittynyt hoitoviive",
          "tulkinta": "Tilanne normalisoituu resurssipulan vuoksi",
          "toimenpide": "Tilapäiset kriisikontaktit",
          "seuraus": "Toistuvat päivystyskäynnit",
          "todennäköisyys": 0.4,
          "kesto_vuotta": 0.5,
          "hypoteesi": false
        },
        {
          "trigger": "Uusi vakava kriisi",
          "tulkinta": "Tilanne eskaloitunut",
          "toimenpide": "Akuutti hoito kriisin kautta",
          "seuraus": "Korkea kuormitus ja vakava riski",
          "todennäköisyys": 0.15,
          "kesto_vuotta": 0.2,
          "hypoteesi": false
        }
      ],
      "learning": {
        "pdca": {
          "plan": "Riskipotilaan tunnistaminen ensikontaktissa",
          "do": "Hoidon lykkääminen jonoon",
          "check": "Oireiden paheneminen ja kriisien toistuminen",
          "act": "Hoitoviiveen tunnistaminen aktiiviseksi päätökseksi"
        },
        "targets": [
          {
            "id": "T1",
            "taso": "Muistaminen",
            "toiminta": "tunnistaa",
            "mittaus": "Triggerien nimeäminen",
            "kriteeri": "3/3 tunnistettu",
            "status": "pending"
          },
          {
            "id": "T2",
            "taso": "Analysoiminen",
            "toiminta": "kuvaa",
            "mittaus": "Päätösketjun visualisointi",
            "kriteeri": "Kaikki vaiheet oikein",
            "status": "pending"
          },
          {
            "id": "T3",
            "taso": "Luominen",
            "toiminta": "laatia",
            "mittaus": "Prosessimuutosehdotus",
            "kriteeri": "Yksi realistinen katkaisupiste",
            "status": "pending"
          }
        ]
      }
    }
  ]
}
